{
  "schema": "fyber.inference_iface/v0",
  "trace_id": "550e8400-e29b-41d4-a716-446655440070",
  "site_id": "net-tn-cottage",
  "actor": {
    "kind": "rule",
    "id": "brewnix-rules/health-v0.1",
    "purpose": "triage"
  },
  "observed_at": "2026-09-07T21:10:00Z",
  "inputs_digest": "sha256:aaaaaaaaaaaaaaaaaaaaaaaaaaaaaaaaaaaaaaaaaaaaaaaaaaaaaaaaaaaaaaaa",
  "judgment": {
    "severity": "high",
    "classes": ["health"],
    "subjects": [{ "kind": "host", "value": "opnsense-cottage" }],
    "summary": "Suricata stopped on opnsense-cottage",
    "evidence_refs": ["health:suricata"]
  },
  "proposals": [
    {
      "call_id": "550e8400-e29b-41d4-a716-446655440071",
      "tool": "health.restart_service",
      "mode": "propose",
      "reason_code": "health_suricata_down",
      "args": {
        "node": "opnsense-cottage",
        "unit": "suricata"
      }
    },
    {
      "call_id": "550e8400-e29b-41d4-a716-446655440072",
      "tool": "notify.operator",
      "mode": "execute",
      "reason_code": "health_suricata_down",
      "args": {
        "channel": "fyber.auditor",
        "severity": "high",
        "text_redacted": "health_suricata_down site=net-tn-cottage node=opnsense-cottage unit=suricata receipt_id=550e8400-e29b-41d4-a716-446655440080"
      }
    }
  ],
  "confidence": 1.0,
  "needs_human": true
}
