{
  "schema": "fyber.inference_iface/v0",
  "trace_id": "550e8400-e29b-41d4-a716-446655440000",
  "site_id": "net-tn-cottage",
  "actor": {
    "kind": "model",
    "id": "qwen2.5-7b-q4@sha256:0123456789abcdef0123456789abcdef0123456789abcdef0123456789abcdef",
    "purpose": "triage"
  },
  "observed_at": "2026-09-06T21:00:00Z",
  "inputs_digest": "sha256:aaaaaaaaaaaaaaaaaaaaaaaaaaaaaaaaaaaaaaaaaaaaaaaaaaaaaaaaaaaaaaaa",
  "judgment": {
    "severity": "critical",
    "classes": ["port_scan"],
    "subjects": [{ "kind": "ip", "value": "203.0.113.50" }],
    "summary": "Burst port scan from 203.0.113.50 on 22/23",
    "evidence_refs": ["eve:cluster-1"]
  },
  "proposals": [
    {
      "call_id": "550e8400-e29b-41d4-a716-446655440001",
      "tool": "firewall.block_ip",
      "mode": "execute",
      "ttl_s": 86400,
      "reason_code": "port_scan_burst",
      "args": {
        "ip": "203.0.113.50",
        "alias": "ai_autoblock",
        "direction": "wan_in",
        "ttl_s": 86400
      }
    }
  ],
  "confidence": 0.91,
  "needs_human": false
}
